{
  "schema_version": "1.0.0",
  "analysis_metadata": {
    "run_id": "d80022423ad5-s0-d0",
    "scenario_id": "3967-gravity",
    "created_at": "2026-10-08T10:04:06.316435+00:00",
    "status": "partial",
    "enabled_analyses": [
      "baseline",
      "layer1_exposure",
      "n1_recovery"
    ]
  },
  "topology": {
    "topology_id": "3967",
    "sha256": null,
    "source": "experiments/datasets/small/Rocketfuel_Topologies/3967.lgf",
    "node_count": 21,
    "reported_edge_count": 36,
    "physical_link_count": 36
  },
  "demand": {
    "demand_id": "gravity",
    "sha256": null,
    "source_type": "unknown",
    "model": "gravity",
    "scale_factor": null,
    "total_demand": 4380.38,
    "unit": "unspecified"
  },
  "solver": {
    "id": "electrical_sketching",
    "name": "Electrical Flow (sketching)",
    "status": "ok",
    "routing_base": null
  },
  "baseline": {
    "status": "partial",
    "metrics": {
      "max_congestion": 37.9097,
      "average_utilization": null,
      "links": [],
      "overloaded_link_ids": [],
      "solver_runtime_microseconds": 719,
      "evaluation_runtime_microseconds": 630.667
    }
  },
  "capacity_headroom": {
    "status": "not_available",
    "minimum_headroom": null,
    "violating_link_ids": []
  },
  "layer1_exposure": {
    "status": "partial",
    "tested_link_count": 36,
    "links": []
  },
  "n1_recovery": {
    "status": "complete",
    "tested_link_count": 36,
    "events": [
      {
        "failed_edge_id": 0,
        "source": 0,
        "target": 7,
        "graph_disconnected": false,
        "recomputation_attempted": true,
        "recomputation_succeeded": true,
        "total_demand": 4380.38,
        "unroutable_demand": 0,
        "unroutable_demand_fraction": 0,
        "baseline_congestion": 37.9097,
        "post_failure_congestion": 47.4679,
        "congestion_increase_factor": 1.25213,
        "recomputation_runtime_microseconds": 603
      },
      {
        "failed_edge_id": 2,
        "source": 0,
        "target": 8,
        "graph_disconnected": false,
        "recomputation_attempted": true,
        "recomputation_succeeded": true,
        "total_demand": 4380.38,
        "unroutable_demand": 0,
        "unroutable_demand_fraction": 0,
        "baseline_congestion": 37.9097,
        "post_failure_congestion": 44.8821,
        "congestion_increase_factor": 1.18392,
        "recomputation_runtime_microseconds": 572
      },
      {
        "failed_edge_id": 4,
        "source": 0,
        "target": 10,
        "graph_disconnected": false,
        "recomputation_attempted": true,
        "recomputation_succeeded": true,
        "total_demand": 4380.38,
        "unroutable_demand": 0,
        "unroutable_demand_fraction": 0,
        "baseline_congestion": 37.9097,
        "post_failure_congestion": 46.228,
        "congestion_increase_factor": 1.21943,
        "recomputation_runtime_microseconds": 551
      },
      {
        "failed_edge_id": 6,
        "source": 0,
        "target": 11,
        "graph_disconnected": false,
        "recomputation_attempted": true,
        "recomputation_succeeded": true,
        "total_demand": 4380.38,
        "unroutable_demand": 0,
        "unroutable_demand_fraction": 0,
        "baseline_congestion": 37.9097,
        "post_failure_congestion": 45.6276,
        "congestion_increase_factor": 1.20359,
        "recomputation_runtime_microseconds": 573
      },
      {
        "failed_edge_id": 8,
        "source": 0,
        "target": 13,
        "graph_disconnected": false,
        "recomputation_attempted": true,
        "recomputation_succeeded": true,
        "total_demand": 4380.38,
        "unroutable_demand": 0,
        "unroutable_demand_fraction": 0,
        "baseline_congestion": 37.9097,
        "post_failure_congestion": 47.6318,
        "congestion_increase_factor": 1.25645,
        "recomputation_runtime_microseconds": 558
      },
      {
        "failed_edge_id": 10,
        "source": 0,
        "target": 19,
        "graph_disconnected": false,
        "recomputation_attempted": true,
        "recomputation_succeeded": true,
        "total_demand": 4380.38,
        "unroutable_demand": 0,
        "unroutable_demand_fraction": 0,
        "baseline_congestion": 37.9097,
        "post_failure_congestion": 52.6989,
        "congestion_increase_factor": 1.39012,
        "recomputation_runtime_microseconds": 568
      },
      {
        "failed_edge_id": 12,
        "source": 1,
        "target": 3,
        "graph_disconnected": false,
        "recomputation_attempted": true,
        "recomputation_succeeded": true,
        "total_demand": 4380.38,
        "unroutable_demand": 0,
        "unroutable_demand_fraction": 0,
        "baseline_congestion": 37.9097,
        "post_failure_congestion": 42.8167,
        "congestion_increase_factor": 1.12944,
        "recomputation_runtime_microseconds": 585
      },
      {
        "failed_edge_id": 14,
        "source": 1,
        "target": 7,
        "graph_disconnected": false,
        "recomputation_attempted": true,
        "recomputation_succeeded": true,
        "total_demand": 4380.38,
        "unroutable_demand": 0,
        "unroutable_demand_fraction": 0,
        "baseline_congestion": 37.9097,
        "post_failure_congestion": 68.4451,
        "congestion_increase_factor": 1.80548,
        "recomputation_runtime_microseconds": 622
      },
      {
        "failed_edge_id": 16,
        "source": 1,
        "target": 11,
        "graph_disconnected": false,
        "recomputation_attempted": true,
        "recomputation_succeeded": true,
        "total_demand": 4380.38,
        "unroutable_demand": 0,
        "unroutable_demand_fraction": 0,
        "baseline_congestion": 37.9097,
        "post_failure_congestion": 60.8616,
        "congestion_increase_factor": 1.60544,
        "recomputation_runtime_microseconds": 577
      },
      {
        "failed_edge_id": 18,
        "source": 2,
        "target": 5,
        "graph_disconnected": false,
        "recomputation_attempted": true,
        "recomputation_succeeded": true,
        "total_demand": 4380.38,
        "unroutable_demand": 0,
        "unroutable_demand_fraction": 0,
        "baseline_congestion": 37.9097,
        "post_failure_congestion": 62.7135,
        "congestion_increase_factor": 1.65429,
        "recomputation_runtime_microseconds": 580
      },
      {
        "failed_edge_id": 20,
        "source": 2,
        "target": 17,
        "graph_disconnected": false,
        "recomputation_attempted": true,
        "recomputation_succeeded": true,
        "total_demand": 4380.38,
        "unroutable_demand": 0,
        "unroutable_demand_fraction": 0,
        "baseline_congestion": 37.9097,
        "post_failure_congestion": 67.607,
        "congestion_increase_factor": 1.78337,
        "recomputation_runtime_microseconds": 570
      },
      {
        "failed_edge_id": 22,
        "source": 3,
        "target": 7,
        "graph_disconnected": false,
        "recomputation_attempted": true,
        "recomputation_succeeded": true,
        "total_demand": 4380.38,
        "unroutable_demand": 0,
        "unroutable_demand_fraction": 0,
        "baseline_congestion": 37.9097,
        "post_failure_congestion": 56.5294,
        "congestion_increase_factor": 1.49116,
        "recomputation_runtime_microseconds": 564
      },
      {
        "failed_edge_id": 24,
        "source": 4,
        "target": 5,
        "graph_disconnected": false,
        "recomputation_attempted": true,
        "recomputation_succeeded": true,
        "total_demand": 4380.38,
        "unroutable_demand": 0,
        "unroutable_demand_fraction": 0,
        "baseline_congestion": 37.9097,
        "post_failure_congestion": 64.8636,
        "congestion_increase_factor": 1.711,
        "recomputation_runtime_microseconds": 567
      },
      {
        "failed_edge_id": 26,
        "source": 4,
        "target": 6,
        "graph_disconnected": false,
        "recomputation_attempted": true,
        "recomputation_succeeded": true,
        "total_demand": 4380.38,
        "unroutable_demand": 0,
        "unroutable_demand_fraction": 0,
        "baseline_congestion": 37.9097,
        "post_failure_congestion": 58.9174,
        "congestion_increase_factor": 1.55415,
        "recomputation_runtime_microseconds": 591
      },
      {
        "failed_edge_id": 28,
        "source": 5,
        "target": 6,
        "graph_disconnected": false,
        "recomputation_attempted": true,
        "recomputation_succeeded": true,
        "total_demand": 4380.38,
        "unroutable_demand": 0,
        "unroutable_demand_fraction": 0,
        "baseline_congestion": 37.9097,
        "post_failure_congestion": 61.9375,
        "congestion_increase_factor": 1.63382,
        "recomputation_runtime_microseconds": 561
      },
      {
        "failed_edge_id": 30,
        "source": 5,
        "target": 12,
        "graph_disconnected": false,
        "recomputation_attempted": true,
        "recomputation_succeeded": true,
        "total_demand": 4380.38,
        "unroutable_demand": 0,
        "unroutable_demand_fraction": 0,
        "baseline_congestion": 37.9097,
        "post_failure_congestion": 47.3895,
        "congestion_increase_factor": 1.25006,
        "recomputation_runtime_microseconds": 572
      },
      {
        "failed_edge_id": 32,
        "source": 5,
        "target": 13,
        "graph_disconnected": false,
        "recomputation_attempted": true,
        "recomputation_succeeded": true,
        "total_demand": 4380.38,
        "unroutable_demand": 0,
        "unroutable_demand_fraction": 0,
        "baseline_congestion": 37.9097,
        "post_failure_congestion": 45.8749,
        "congestion_increase_factor": 1.21011,
        "recomputation_runtime_microseconds": 637
      },
      {
        "failed_edge_id": 34,
        "source": 5,
        "target": 15,
        "graph_disconnected": false,